{
  "chain_family": "evm",
  "author": "Argus",
  "created": "2026-10-26",
  "tier": "pattern",
  "id": "HZ-013",
  "placard_class": 3,
  "placard_class_name": "authority",
  "title": "Pause is gated by a single owner with no two-step handover",
  "summary": "One owner key can halt transfers, and ownership moves in a single transaction, so a mistyped or compromised key takes effect immediately with no acceptance step. Everything holding the token, including other contracts, inherits that exposure.",
  "matcher": {
    "kind": "selector-set",
    "require_all": [
      "0x8456cb59",
      "0x3f4ba83a",
      "0x8da5cb5b"
    ],
    "require_none_of": [
      "0x79ba5097"
    ],
    "notes": "pause() 0x8456cb59, unpause() 0x3f4ba83a, owner() 0x8da5cb5b; absence checked over acceptOwnership() 0x79ba5097 only. selectors derived in-repo and verified present in the deployed runtime"
  },
  "money_bound": {
    "kind": "capability",
    "expression": "every balance of the token, including value held inside other contracts, is unspendable while paused"
  },
  "reproduction": {
    "kind": "manual",
    "command": "hazmat scan --code 0x43506849D7C04F9138D1A2050bbF3A0c054402dd --chain mainnet",
    "expected": "pause, unpause and owner present; no acceptOwnership selector"
  },
  "confirmed_on": [
    {
      "target": "USDC implementation 0x43506849D7C04F9138D1A2050bbF3A0c054402dd chainId 1 (23,464 bytes, 59 selectors)"
    }
  ],
  "fix": "Two-step ownership transfer, and say in the docs what a pause stops.",
  "provenance": {
    "first_observed": "2026-10-26",
    "specimen": "USDC implementation, mainnet",
    "published_source": "implementation selectors",
    "deployed_verified": "0x43506849D7C04F9138D1A2050bbF3A0c054402dd chainId 1",
    "evidence": [
      "pause(), unpause(), paused() and owner() are all present in the runtime",
      "no acceptOwnership() selector, so handover is single-transaction"
    ]
  }
}
