{
  "chain_family": "evm",
  "author": "Argus",
  "created": "2026-10-26",
  "tier": "pattern",
  "id": "HZ-014",
  "placard_class": 3,
  "placard_class_name": "authority",
  "title": "An external allow/deny list can freeze balances without touching the contract",
  "summary": "A list administrator can mark any address and stop its transfers. The list lives off-chain, so the contract stays immutable while the set of addresses that may move funds changes, and anything holding the token inherits the freeze.",
  "matcher": {
    "kind": "selector-set",
    "require_all": [
      "0xf9f92be4",
      "0xfe575a87"
    ],
    "require_any": [
      "0xbd102430",
      "0x1a895266"
    ],
    "notes": "blacklist(address) 0xf9f92be4, isBlacklisted(address) 0xfe575a87, blacklister() 0xbd102430, unBlacklist(address) 0x1a895266. selectors derived in-repo and verified present in the deployed runtime"
  },
  "money_bound": {
    "kind": "per-event",
    "expression": "any balance of the token, including value sitting inside an escrow or vault that holds it"
  },
  "reproduction": {
    "kind": "manual",
    "command": "hazmat scan --code 0x43506849D7C04F9138D1A2050bbF3A0c054402dd --chain mainnet",
    "expected": "blacklist, isBlacklisted and blacklister present; the list itself is off-chain"
  },
  "confirmed_on": [
    {
      "target": "USDC implementation 0x43506849D7C04F9138D1A2050bbF3A0c054402dd chainId 1",
      "why_it_matters_here": "an escrow that holds this token documents that it cannot override the token; this is the selector-visible half of that"
    }
  ],
  "fix": "Say who holds the list, and check counterparties for membership before relying on a transfer.",
  "provenance": {
    "first_observed": "2026-10-26",
    "specimen": "USDC implementation, mainnet",
    "published_source": "implementation selectors",
    "deployed_verified": "0x43506849D7C04F9138D1A2050bbF3A0c054402dd chainId 1",
    "evidence": [
      "blacklist, unBlacklist, isBlacklisted, blacklister and updateBlacklister are all present",
      "nothing in the runtime bounds how many addresses the list may hold"
    ]
  }
}
